reference,actual
"Las antenas que trabajan en esta longitud de onda tienen que ser de un tamaño inferior a 1 mm, y sería muy conveniente que la modulación electrónica estuviera inmediatamente después de la antena, logrando así dispositivos muy compactos, ideales para comunicaciones a cortas distancias, por ejemplo en aplicaciones de redes de sensores Thayne, 2004.","Las antenas que funcionen en esta longitud de onda deben ser inferiores a 1 mm y es muy deseable que la modulación electrónica se realice inmediatamente después de la antena, logrando así dispositivos muy compactos adecuados para la comunicación a corta distancia, por ejemplo en aplicaciones de redes de sensores Thayne 2004."
"El análisis estadístico se hizo utilizando el test de χ o el test exacto de Fisher para comparaciones o proporciones, y análisis de varianza para comparaciones entre medias.","El análisis χ2 o el análisis exacto de Fisher se utilizó para el análisis estadístico de comparaciones o porcentajes, y el análisis de variación se utilizó para comparar promedios."
"La diferencia que marcó esta Revista, que funciona hasta el presente, fue que, previo a su publicación, los artículos comenzaron a ser revisados por pares de dicha Sociedad.","La característica distintiva de esta revista, que sigue publicando hasta nuestros días, fue que sus artículos fueron revisados por compañeros de la Sociedad antes de ser publicados."
"Dentro de las pruebas no invasivas para el diagnóstico de H. pylori se encuentra el test respiratorio urea TRU, la determinación de antígenos fecales y las pruebas inmunológicas; de estas pruebas solo se recurre al TRU y a los antígenos fecales para la confirmación de la erradicación ya que las inmunológicas tienden a permanecer positivas por años 6.","Entre las pruebas no invasivas para el diagnóstico de H. pylori se incluyen la prueba de respiración de urea UBT, la evaluación de antígenos fecales e pruebas inmunológicas."
"En este sentido, constituye una “copia” gestual de la imagen mental, y, por lo tanto, su significado es de más fácil comprensión.","En este sentido, constituye una copia gestual de la imagen mental, y por lo tanto, su significado es más fácil de entender."
Los resultados ponen de manifiesto que la contabilidad de gestión no ocupa un lugar destacado en las publicaciones en revistas españolas y brasileñas.,Los resultados muestran que la contabilidad de gestión no ocupa un lugar destacado en las revistas españolas y brasileñas.
Una formulación tardía de Lacan parecería refutar esta idea.,La última formulación de Lacan parece refutar esta idea.
"Las causas de tal disminución se deben al endurecimiento de las medidas para atenuar la migración ilegal a Estados Unidos, la desaceleración en el sector de la construcción y las expectativas de menor crecimiento en la economía de aquel país.","Las causas de dicha disminución se deben al endurecimiento de las medidas destinadas a atenuar la migración ilegal hacia Estados Unidos, a la desaceleración del sector de la construcción y a las expectativas de un crecimiento más lento de la economía de ese país."
"La comunicación de América Central con el mundo y la posibilidad de unir ambos océanos a través de la navegación de los ríos, los lagos interiores y canales construidos al efecto es un tópico que se repite en todos los exploradores de las ruinas mayas, perdidas en la selva y tan invisibles para los pobladores locales como la riqueza ligada a la navegación de los ríos.","La comunicación entre América Central y el resto del mundo y la posibilidad de conectar ambos océanos navegando por los ríos, lagos interiores y canales construidos especialmente para este propósito es un tema mencionado por todos los exploradores de las ruinas mayas - perdidas en la selva y tan invisibles para las poblaciones locales como la riqueza vinculada a navegar por los ríos."
"Nótese que mientras la violencia criminal en H1 resulta de la incapacidad del gobierno federal y la oposición subnacional de coordinar sus acciones antidrogas, la violencia en H2 resulta de la decisión estratégica del presidente de castigar a sus rivales políticos subnacionales al dejar sin protección a los funcionarios públicos locales frente a grandes amenazas criminales.","Tenga en cuenta que mientras que la violencia criminal en H.1 resulta de la incapacidad de los partidos de oposición nacionales y subnacionales para coordinar sus acciones contra las drogas, la violencia en H.2 resulta de la decisión estratégica del presidente de castigar a sus rivales políticos subnacionales dejando a los funcionarios del gobierno local sin protección contra las amenazas criminales principales."
No hubo complicaciones con el procedimiento.,No hubo complicaciones en ninguno de los procedimientos.
"La preocupación con la calidad de vida de los individuos, descrita a principios de la década de los 90, se ha destacado con los protocolos de autoevaluación del impacto de una disfonía, aplicados en pacientes disfónicos durante las dos últimas décadas.","La preocupación por la calidad de vida de los individuos, descrita a principios de los 90, se ha resaltado con protocolos de autoevaluación del impacto de la disfonía, utilizados en pacientes con disfonía durante las últimas dos décadas."
"Los países en desarrollo representan alrededor del 98 % de la producción total, mientras que los países desarrollados representan el 80 % del comercio mundial de importaciones .","Los países en desarrollo representan alrededor del 78% de la producción total, mientras que los países desarrollados representan el 80% del comercio mundial."
"Y en cuanto a esto tiene el espíritu muy gran semejanza con los cuerpos celestiales, porque así como ellos no tienen contrario, así también los espíritus no tienen contrario, porque siendo medio participan de todos extremos, y así a ninguno tiene por contrario, y por esta razón, así como los cuerpos celestiales cada uno de ellos tiene su inteligencia, diputada para que asista con ellos y los mueva: así mismo el espíritu vital tiene consigo diputada una inteligencia práctica que asiste con él, la cual inteligencia hace mediante el espíritu las obras naturales .","Y en este sentido el espíritu se parece mucho a los cuerpos celestes, pues así como no tienen opuestos, tampoco los espíritus tienen opuestos, porque siendo el medio comparten todos los extremos, y por lo tanto ninguno de ellos son opuestos, y por esta razón, así como cada uno de los cuerpos celestes tiene su inteligencia, concedida para ayudarlo y impulsarlo: de la misma manera al espíritu vital se le ha concedido una inteligencia práctica que le ayuda, y esa inteligencia lleva a cabo las obras de la naturaleza a través del espíritu."
"Esas comunidades constituyen verdaderos sumideros de carbono para formar las estructuras de los organismos y que después se convierten, parcialmente, en materia orgánica , por lo que la distribución de la biomasa en los árboles es crucial en la velocidad de acumulación de esta última y en el flujo de C .","Estas comunidades son verdaderos sumideros de carbono para formar las estructuras de los organismos y luego parcialmente convertidas en materia orgánica, de modo que la distribución de biomasa en los árboles es crucial para la tasa de acumulación de este último y el flujo C."
Fundación Santa Fe de Bogotá. Bogotá DC -Colombia.,"En el 97,4% de los casos, se logró la canulización venosa con éxito en el primer intento."
La antropología científica y la medicina sanitaria asumieron ese objeto de indagación con cierto desfase.,"La antropología científica, la medicina y la atención médica adoptaron este objeto de investigación uno tras otro."
"Como en general las viviendas tienen un gran conjunto de atributos importantes, a partir de la recopilación de los primeros datos, no es posible detallar todos los casos dentro de una gran base de datos.","Como las propiedades en general tienen un gran conjunto de atributos importantes, detallando todos los casos en una gran base de datos desde la primera recopilación de datos no es viable."
"La propensión subjetiva al riesgo se asoció con las respuestas en los juegos de lotería una vez ajustados el resto de variables individuales, aumentando la puntuación media en L1 en 0,241 puntos IC95%:0,159-0,323 y 0,121 en L2 IC95%:0,074- 0,168 cuando se compararon las respuestas más altas con las más bajas de la escala autoreportada.","La inclinación al riesgo auto-evaluada se asoció con las respuestas de los juegos de lotería una vez que se ajustaron los demás variables individuales, aumentando la puntuación media en L1 en 0,241 puntos con IC 95%: 0,159-0,323 y en L2 con IC 95%: 0,074-0,168 cuando se compararon las puntuaciones más altas y las más bajas de la escala auto-informada."
El tiempo promedio de sobrevida fue de 102 días para los que tuvieron PMAE duodenal rango 1-743 y de 159 días rango 17-577 en las PMAE colorrectales.,El tiempo promedio de supervivencia fue de 102 días para los pacientes con SEMS duodenal de un rango de 1- 743 y 159 días para el SEMS colorrectal de 17 a 577.
La compra de 20 millones de dosis costó al gobierno mexicano 2 mil millones de pesos que además fueron insuficientes durante la pandemia.,"La compra de 20 millones de dosis costó al gobierno mexicano 2 mil millones de pesos, una cantidad de dosis que era insuficiente durante la pandemia."
"Se encontró asociación entre el nivel socioeconómico bajo y medio con el riesgo a desarrollar CG, p = 0,000 tabla 1.",Existe una asociación entre los niveles socioeconómicos bajos y medios con el riesgo de desarrollar GC p=0.000 Tabla 1.
Etapa 4: Tres horas después se realizaron nuevas mediciones organolépticas y de los niveles de CVS.,Etapa 4: Tres horas después del inicio del procedimiento se registraron nuevos niveles organolepticos y de VSC.
"De encontrar imagen sonográfica de paro circulatorio cerebral, se podría concluir que el flujo en la ACM vaso intracraneal, rama terminal de la arteria carótida interna ACI es igual o peor que este.","Los hallazgos sonográficos de la parada cerebral de la circulación sanguínea permiten concluir que el flujo en el vaso intracraneal MCA, rama terminal de la arteria carótida interna ICA, es igual o peor que el flujo observado en la carótida."
"Se considera fundamental conocer la situación colombiana y con ello determinar la posible brecha en diagnóstico y manejo de este tipo de pacientes, con respecto a otros países.",REGATE es un registro de enfermedades diseñado para capturar y analizar datos de pacientes con CG recién diagnosticados en cualquier etapa de la enfermedad.
"Así, el sistema celular como el sistema de telefonía fija se diseña para las condiciones esperables en las horas punta es decir, en un período entre las 10:15 y 11:15 de la mañana, por ejemplo.","Por lo tanto, el sistema celular y también el sistema de telefonía por cable están diseñados para las condiciones de tráfico que ocurren en la hora punta, es decir, en el período entre las 10:15 y las 11:15 am, por ejemplo."
"Para mantener la reproducción de sus sistemas agropecuarios algunos agricultores, principalmente los más jóvenes, mejoran sus ingresos ofertando su mano de obra en actividades extraprediales como jornales en obras de pavimentación de caminos, construcción y reparación de acequias, reparación de obras de arte, jornales en empresas mineras o de servicios entre otras actividades.","Para mantener la economía de sus sistemas agrícolas, algunos agricultores, principalmente los más jóvenes, mejoran sus ingresos trabajando fuera de la granja en trabajos como pavimentar carreteras, construir y reparar canales, reparar obras de arte antiguas, minería o servicios, entre otros."
Esta regeneración del hueso continúa durante toda la vida del injerto con un ritmo normal de recambio de resorción-remodelación igual que el resto del esqueleto aproximadamente 0.7% por día.,"Esta regeneración ósea continúa durante toda la vida del injerto, con un ritmo normal de remodelación-reabsorción similar al resto del esqueleto aproximadamente del 0,7% al día."
La falta de atención a los pacientes de su salud mental en general podría tener como resultado una disminución de la autoestima que se observa en los pacientes con curvas más suaves.,La falta de atención prestada a la salud mental en general podría ser la causa de la reducción de la autoestima observada en pacientes con curvas menos severas.
"En palabras del director porteño Ricardo Bartís 2006, p. 26:","En palabras del director de teatro argentino Ricardo Bartís 2006, p."
Estos resultados demuestran que la convergencia fue difícil de alcanzar incluso para este caso básico de NC.,Estos resultados muestran que la convergencia fue difícil de alcanzar incluso para este caso NC básico.
Este descubrimiento sugiere que la protusión bimaxilar en mujeres mexicanas es estéticamente más aceptable que en hombres mexicanos en la comunidad latina.,Este descubrimiento sugiere que la protrusión bimaxillar es más aceptable en las mujeres mexicanas que en los hombres dentro del alcance de la comunidad latina.
paradigmas en competencia no tiene idénticas limitaciones cuando se trata de ofrecer soluciones plausibles a los problemas que el mundo presenta.,Los paradigmas competitivos no tienen las mismas limitaciones en cuanto a ofrecer soluciones plausibles a los problemas que presenta el mundo.
"Además, sus ramas adyacentes carecen de una adecuada demarcación en la pared del aneurisma.",Sus ramas adyacentes también carecen de una demarcación adecuada en la pared del aneurisma.
"Esto con el fin de evitar inestabilidad numérica en la solución, dada cuando decrece rápidamente el esfuerzo con el aumento de la deformación.",En la parte superior para evitar la inestabilidad numérica de la solución que se produce cuando el estrés disminuye rápidamente mientras aumenta la tensión.
"Además, nuestros resultados sugieren que los responsables de los medios de Comunicación deberían prestar mayor atención a aquellas prácticas que pueden afectar positivamente a la credibilidad de sus medios de Comunicación, desde el punto de vista de los consumidores, como son las asociaciones o imagen de los medios, así como su notoriedad y la fidelidad hacia los mismos.","Además, nuestros hallazgos sugieren que los gerentes de medios deberían prestar más atención a las prácticas que pueden afectar positivamente su credibilidad en los medios de comunicación desde el punto de vista del cliente, que son las asociaciones o imagen de los medios, junto con su lealtad y conciencia."
"Esta primera indagación, compuesta de un corpus de quince entrevistas no sólo aportó datos para realizar los primeros ajustes teóricos, confrontando así el marco conceptual indagado con las categorías de los entrevistados, sino que fue crucial en el proceso de selección de las carreras a estudiar.","En primer lugar, se centró en entrevistas con estudiantes de cada facultad de la Universidad Nacional de Rosario: un conjunto de 15 entrevistas proporcionó no sólo datos para los primeros entornos teóricos, enfrentando así el marco conceptual investigado a través de las categorías de entrevistados, sino que también fue crucial en la selección de carreras."
De esta forma se tuvo un total de 36 combinaciones 2 x 3 x 2 x 3 a evaluar.,Se evaluaron un total de 36 combinaciones 2 x 3 x 2 x 3.
"En el marco de una enfermería humanística, esta relación se entiende como una ''vivencia armónica con uso adecuado del tiempo compartido que humaniza los llamados y las respuestas''.","En el contexto de la enfermería humanista, esta relación se entiende como una ""experiencia armoniosa con un uso adecuado del tiempo compartido que humaniza las solicitudes y respuestas""."
"En el cuarto apartado se presentan un diagrama modelo y tres tipos básicos de cadenas de valor, se analizan los costos de producción de una botella de vino, las ventas y distribución de éste; también se discuten los principales problemas enfrentados por los productores de vino y termina con una serie de conclusiones.","La cuarta sección incluye un modelo de diagrama y tres tipos básicos de cadena de valor y presenta un análisis de los costes de producción de una botella de vino y de la venta y distribución de vino, así como de los principales problemas que afectan a los productores de vino."
En los artículos encontrados la variabilidad ha sido observada a distintos niveles de agrupación.,"En los artículos revisados, se ha observado variabilidad desde la perspectiva de diferentes agrupaciones."
"Ecológicamente, estrategias de manejo de procesos de sedimentación, inundación y reforestación generadas por los cambios hidrológicos permitirían desplegar nuevas tipologías de paisaje.","Desde el punto de vista ecológico, las estrategias de gestión de los procesos de sedimentación, inundación y reforestación generados por los cambios hidrológicos permitirían el despliegue de nuevas tipologías de paisaje."
Se debe elegir únicamente el rumbo principal y dejar pendiente la solución específica que va a ser propuesta.,"Se debe seleccionar únicamente el curso principal, dejando pendientes las soluciones específicas que se propongan."
La sonda de temperatura se introdujo a través de la nasofaringe una vez asegurado el tubo endotraqueal.,"Después de asegurar el ETT, se introdujo una sonda de temperatura a través de la nariz."
El desempeño de la musculatura dorsiflexora de tobillo obtenido en la presente investigación tabla 2 concuerda con lo reportado en experiencias previas.,Los resultados presentados en el presente documento para el rendimiento de los músculos dorsiflexor del tobillo Tabla 2 son similares a los reportados en estudios anteriores.
"A su vez, Miller et al., investigaron la relación entre las imágenes de resonancia nuclear magnética cefalométrica, la función muscular del sistema estomatognático durante la producción del habla y la voz, logrando verificar la presencia de correlaciones entre huesos cráneo faciales, vértebras cervicales, tamaño de las vías respiratorias, posición del hueso hioides, laringe, la epiglotis, úvula y mentón.","Miller et al. investigaron la relación entre las imágenes de la resonancia magnética de imagen de resonancia magnética cefalométrica, la función muscular del sistema estomatognático durante la producción del habla y la voz; pudieron verificar la existencia de correlaciones entre los huesos cranio-faciales, las vértebras cervicales, el tamaño del tracto respiratorio y la posición del hueso hyoide, laringe, epiglotis, uvula y mandíbula."
"Por concepto del anestesiólogo experto, las recomendaciones sobre las condiciones de la sala de cuidado postoperatoria, del ingreso y egreso del paciente a la sala se complementaron a partir de las guías de The Association of Anaesthetists of Great Britain and Irelandy de la Scottish Intercollegiate Guidelines Network.","En opinión del especialista en anestesiología, las recomendaciones sobre las condiciones de la sala de atención postoperatoria, la admisión y la salida del paciente de la sala se complementaron con las directrices de la Asociación de Anestesiólogos de Gran Bretaña e Irlanda y de la Red Escocesa de Directrices Intercolegiadas."
"Así, la presencia de 'la mujer europea' se pretendió concretar en un aspecto, fundamentalmente: la mujer como proveedora de cuidados médico-sanitarios 'modernos', representados en la figura de mujeres profesionales de la medicina occidental.","Así, se intentó resolver la presencia de la ""mujer europea"" en un aspecto fundamental: las mujeres como proveedoras de atención médica-sanitaria ""moderna"", encarnadas en la figura de las mujeres profesionales de la medicina occidental."
Esta investigación demostró que los modelos lineales generalizados ofrecen una solución razonable para entender la variación en la densidad de venados como respuesta a los atributos de su hábitat.,Esta investigación mostró que los modelos lineales generalizados ofrecen una solución razonable para comprender la variación en la densidad de los ciervos debido a los atributos de su hábitat.
"Asociación Colombiana de Ingeniería Sísmica 1998: fc=28 MPa, Fy=420 MPa, =24870 MPa y Υconcreto;=24kN/m. Para realizar el análisis, se tomaron dos casos extremos de respuesta local del suelo de acuerdo con la referencia FOPAE Fondo de prevención y atención de emergencias 2012, a la luz de la nueva microzonificación sísmica de Bogotá: Piedemonte B y Lacustre-500.","Asociación Colombiana de Ingeniería Sísmica 1998: fc=28 MPa, Fy=420 MPa, =24870 MPa y Υconcreto;=24kN/m. Para llevar a cabo el análisis, se examinaron dos casos extremos que muestran una respuesta local del suelo de conformidad con el Fondo de prevención y atención de emergencias 2012 de referencia FOPAE, a la luz de la nueva microzona sísmica en Bogotá: Foothill B y Lake Plateau-500."
El problema de estos estudios es el subregistro de casos 5.,El problema con estos estudios está en el informe de casos 5.
"Dichas transiciones generan una serie de tensiones y confrontaciones entre el sujeto joven y los entornos familiar, afectivo, académico, ideológico y político.","Estas transiciones generan tensiones entre los jóvenes y sus entornos familiares, afectivos, académicos, ideológicos y políticos."
"En este sentido, tiene una visión del cuidado auténtico como algo para si y para otras personas, un sentido de cuidado relacional de la vida, como algo que esta en la estructura original de la existencia humana, en el tiempo y en el mundo.","En este sentido, una visión de un cuidado auténtico es algo para uno mismo y para los demás, un sentido de cuidado relacional para la vida, algo que se encuentra en la estructura original de la existencia humana, en el tiempo y en el mundo."
"El que no tiene habilidades para construir por sí mismo depende de la contratación de artesanos, que trabajan por cuenta propia y cobran entre 100 y 300 pesos por día laboral, no siempre tienen licencia para ejercer su oficio.",Los que no tienen la capacidad de construir su propia vivienda dependen del reclutamiento de artesanos que trabajan por su cuenta y cobran 100-300 CUC 108-324 USD por día de trabajo; algunos de estos artesanos no tienen permisos.
El interés del presente trabajo se focaliza en un uso específico de la telefonía móvil realizado por un sector etario de la juventud.,El presente trabajo pretende centrarse en un uso específico de los teléfonos móviles realizado por un grupo de edad de jóvenes.
El uso de dilataciones endoscópicas fue decisión del cirujano gastrointestinal que realizó el procedimiento y nunca se realizaron dilataciones después de colocar la prótesis.,El uso de la dilatación endoscópica depende del cirujano gastrointestinal que realiza el procedimiento y las dilataciones nunca se realizan después de la colocación del stent.
El resultado se muestra en la figura 2.,El resultado se muestra en la figura 2.
"Las familias presentaron homogeneidad p ≥ 0,05 con relación al tamaño cuatro a nueve personas por familia.","Las familias eran homogéneas p ≥ 0,05 en términos de tamaño entre cuatro y nueve individuos por familia."
"Para determinar el daño causado a la membrana basal por esta célula, se has correlacionado las concentraciones de laminina y lactoferrina encontrándose hiperreactividad durante el proceso de transmigración a través de endotelio y epitelio.","Para determinar el daño causado por esta célula a la membrana basal, se han correlacionado las concentraciones de laminina y lactoferrina."
"El vestíbulo superior tiene una superficie de 269 m² y una altura libre de 3,2 m fig.","El vestíbulo superior tiene una superficie de 269 m2 y una altura de 3,2 metros de altura."
"El resultado fue la identificación de cuatro tipos de clientes a los que hemos denominado ""cliente misógino"", ""cliente consumidor"", ""cliente amigo"" y ""cliente crítico"" véase Figura 1.","El resultado fue la identificación de cuatro tipos de clientes que hemos denominado: ""cliente misógino"", ""cliente de consumo"", ""cliente amigable"" y ""cliente crítico"" véase la figura 1."
"El cálculo de la velocidad de deflagración laminar y la temperatura de llama adiabática se hizo por medio de simulaciones de la mezcla reaccionante a 298 K y 1 atm en el software Chemkin Kee, R. J. et al., 2004 utilizando el mecanismo de reacción Grimech 3.0 Smith et al., s/f.","La velocidad de deflagración laminar y la temperatura de la llama adiabática se determinaron utilizando simulaciones de mezcla de combustible con aire en el software de CHEMKIN Kee et al., 2004 y el mecanismo de reacción GRIMECH 3.0 Smith et al., 1999."
Este grupo está conformado por tres factores en comités de seguridad.,Este grupo contiene tres factores de los comités de seguridad.
"Zhang et al. 2007 encontraron que los modelos de ecuación-cero, k-ε RNG y v2f-dav predicen adecuadamente las condiciones del flujo de aire en cavidades cerradas con un número Raleigh bajo.","Zhang et al. 2007 encontraron que los modelos de ecuación cero, k-ε RNG y v2f-dav predicen condiciones de flujo de aire en cavidades cerradas con bajo número de Raleigh."
