reference,actual
"Además, El Minuto de Dios era consciente que era fundamental tratar de conformar una comunidad donde no existía, pues las familias que iban a ser reasentadas vivían inicialmente en barrios distintos, por consiguiente tenían que aprender a conocerse.","Además, Gods Minute era consciente de la importancia de establecer una nueva comunidad, ya que las familias relocadas venían de barrios diferentes y tenían que conocerse entre sí."
"Cra 6 10N-142, Popayán, Colombia.",Estos ensayos se distribuyeron aleatoriamente entre 6 evaluadores capacitados en el uso de la herramienta de detección de riesgo de sesgo de la Cochrane Collaboration.
"Estos resultados concuerdan con los nuestros ya que encontramos diferencias significativas en la profundidad de curado cuando la fuente de luz se colocó directamente sobre el sellador de fosetas y fisuras2.014mm, a 5 mm de distancia 1.843 mm y a 10 mm de distancia 1.623 mm.","Estos resultados coincidieron con los nuestros, ya que encontramos diferencias significativas en la profundidad de curado cuando la fuente de luz se colocó directamente sobre el sellador de fosas y grietas 2.014 mm a una distancia de 5 mm de 1,843 mm y 10 mm de 1,623 mm."
En las subastas de infraestructura de telecomunicaciones Alcatel-Lucent puede pugnar con la china Huawei; la española Telefónica se ve con la mexicana América Móvil en los países latinos y la francesa Carrefour sufre en Brasil con la brasileña Pão de Açúcar por citar algunos ejemplos.,"En las subastas de infraestructura de telecomunicaciones, Alcatel-Lucent podría luchar contra Huawei de China; Telefónica de España compite con América Móvil de México en los países latinoamericanos; y Carrefour de Francia lucha en Brasil contra Pão de Açúcar de Brasil sólo para mencionar algunos ejemplos."
"Los entrevistados argumentaron que el desarrollo de nuevas técnicas de fundición pueden otorgar mayores oportunidades a la industria, para mejorar su actividad comercial y su competitividad a nivel mundial Tsi, 2002.","Los entrevistados argumentaron que el desarrollo de nuevas técnicas de fundición puede proporcionar una mejor oportunidad para que la industria mejore su propio negocio y su competitividad en todo el mundo Tsi, 2002; sin embargo, esto solo puede lograrse a largo plazo."
La fuga de la anastomosis esófago-yeyunal después de cirugía por cáncer es una complicación seria que conlleva cifras importantes de morbilidad y mortalidad.,La fuga de una anastomosis esofágico-jejunal después de una cirugía para el cáncer es una complicación grave que tiene un alto riesgo de morbilidad y mortalidad.
"A su criterio, si la mujer trabajaba durante el embarazo, el hijo heredaría tendencias mórbidas.","En su opinión, si las mujeres trabajaban durante el embarazo, sus hijos heredarían tendencias morbosas."
"La cromoendoscopia particularmente con magnificación ayuda a identificar lesiones precancerosas; sin embargo, esta técnica requiere de amplia experiencia, prolonga el tiempo de estudio y adiciona carga de trabajo e implica mayor tolerancia del paciente, por lo que no podría en la actualidad recomendarse sistemáticamente y debería reservarse para centros con alta experiencia en la técnica.","La cromoendoscopia, especialmente con aumento, ayuda a identificar las lesiones precancerosas, sin embargo, esta técnica requiere una amplia experiencia, prolonga el tiempo de estudio, aumenta la carga de trabajo y requiere más paciencia del paciente. Por esta razón no se recomienda sistemáticamente, pero debe reservarse para centros con mucha experiencia con esta técnica."
"En ese sentido, este estudio también concluye que es importante la formación del personal para mejorar la calidad asistencial y el desarrollo de investigaciones cualitativas que profundicen en este campo .",La revisión enfatizó la falta de instrumentos para medir las actitudes.Creemos que es importante formar profesionales para mejorar la calidad de la atención y que se necesitan estudios cualitativos para investigar más este tema.
A esa primera comunicación le siguió una serie de avances tecnológicos que poco a poco fueron mejorando la calidad de las comunicaciones y también la cantidad.,Esta primera comunicación inalámbrica continuó una serie de avances tecnológicos que mejoraron gradualmente la calidad y la cantidad de la comunicación.
"Allí señalaba que hasta ese momento la fotografía había tenido un limitado uso para representar organismos marinos y aunque se habían logrado excelentes fotografías de animales mantenidos en acuarios bajo condiciones más o menos artificiales, el trabajo había sido llevado escasamente más allá de esto.","En él, señaló que hasta entonces la fotografía había sido de uso limitado para representar organismos marinos y que, aunque existían excelentes fotografías de animales mantenidos en acuarios en condiciones más o menos artificiales, el trabajo más allá de eso había sido escaso."
"Por ello y con el fin de optimizar el consumo energético, se han analizado diversas medidas de eficiencia energética de acuerdo a un modelo energético basado en el actual consumo de diésel para calefacción.","Por esta razón, para optimizar el consumo de energía, se analizaron varias medidas de eficiencia energética en un modelo energético calibrado basado en el consumo de diésel de base actual para la calefacción."
"Sin embargo, esto cambió considerablemente hacia finales de la década los sesenta, varios años después de que Moses dejara su lugar a cargo de la infraestructura de la ciudad.","Sin embargo, esto cambia considerablemente a finales de los años sesenta, varios años después de que Moisés abandonara su lugar a cargo de la infraestructura de la ciudad."
"Los parámetros de entrada son las propiedades y geometría del cable, el peso y la posición del acelerómetro y el archivo de las señales a utilizar provenientes de la instrumentación realizada.","Los parámetros de entrada son las propiedades y la geometría del cable, el peso y la posición del acelerómetro y el archivo para utilizar las señales de la instrumentación realizada."
"La craneotomía en el paciente despierto plantea un reto singular para los anestesiólogos, y el éxito del procedimiento depende en gran medida de una selección cuidadosa del paciente y de la experiencia del equipo quirúrgico y de anestesia.","La craniotomía en el despertar representa un desafío único para los anestesiólogos, y su éxito depende en gran medida de la selección cuidadosa del paciente y de la experiencia del equipo quirúrgico y anestesiólogo."
"Relacionándose con otros con respeto, humildad y enseñar a descubrir el aprendizaje en cada momento de la vida.","Interactuar con los demás con respeto, humildad y enseñar a descubrir en cada momento de la vida."
"En este marco, la cooperación internacional debe contribuir a la creación de capacidades locales en los países participantes, a fin de fortalecer las posibilidades de crear y aplicar conocimientos a escala regional y mundial.","En este marco, la cooperación internacional debe contribuir a la creación de capacidades locales en los países implicados, con el fin de fortalecer las posibilidades de creación y aplicación del conocimiento a escala regional y global."
"Para André Barbosa, la campaña fue también una reafirmación internacional de una política exterior ""menos imperialista"", con la construcción de una imagen brasileña como ""potencia amiga"" de los países vecinos.","André Barbosa, la campaña también fue una reafirmación internacional de una política exterior ""menos imperialista"", con la construcción de una imagen brasileña como vecinos ""poder amistoso""."
El programa experimental incluye la realización de ensayos de resistencia a la compresión diametral y absorción de agua.,El programa experimental incluía pruebas de resistencia a la compresión diametral y de absorción de agua.
"Tras enfrentar los celos, la violencia física y psicológica de su esposo, decide irse a la Sierra con sus hijos.","Después de enfrentar el celos, la violencia física y psicológica de su marido, decidió irse a las Sierras con sus hijos."
"Sin embargo, no se encontraron diferencias demostrables en relación con el número de errores o incidentes.","Sin embargo, no se encontraron diferencias obvias en cuanto al número de errores o incidentes."
"Este factor resultó clave en la conformación de la percepción sobre los conflictos asociados a la minería, y la generación de temores o miedos entre la población.",Este factor fue crucial para dar forma a la percepción de los conflictos asociados con la minería y del miedo o preocupación que produce la población.
"Así se habría establecido una relación técnica, explotadora y alienante entre la humanidad y la naturaleza McWorther y Stenstad, 2009.","Así se habría establecido una relación técnica, explotadora y alienadora entre la humanidad y la naturaleza McWorther & Stenstad, 2009."
Fundación Valle del Lili. Av. Simón Bolívar.,Resultados: En el análisis se incluyeron cuarenta y siete pacientes.
"Desde la primera descripción del TOH por Tomas Starzl 1 en 1963, se han implementado significativos avances en aspectos como la selección de órganos, el explante, soluciones de preservación, técnicas de implantación e inmunosupresión, entre otras.","Desde la primera descripción de la OLT por Tomas Starzl 1 en 1963 se han producido avances significativos en áreas como la selección de órganos, la exploración, las soluciones de conservación, las técnicas de implantación y la inmunosuppresión."
Estos resultados implican una reducción del 74 % y el 90% en las derivas máximas lo cual es consistente con las referencias Marín J. y Ruiz D. 2005 y Fuentes et al. 2005.,"Estos resultados implican una reducción del 74% y del 90% de las derivaciones máximas, lo que es consistente con las referencias de Marín y Ruiz 2005, y Fuentes et al."
¿Cuál es la naturaleza de la ruta de comunicación entre el microorganismo patógeno y la célula vegetal?,¿Cuál es la naturaleza de la vía de comunicación entre el microbio y la célula vegetal?
Muchos países también han conseguido reducir sus tasas de letalidad por accidentes de tránsito en los últimos decenios.,Muchos países también han logrado reducir sus tasas de mortalidad en el tráfico vial en las últimas décadas.
La reparación más sugerida es el cambio de junta a goma asfáltica y el aumento de las labores de mantenimiento.,La acción de restauración propuesta es la sustitución por asfalto de caucho y el aumento de las tareas de mantenimiento.
Se construyó acoplando cestas hiperbólicas cuya forma de trabajo ya había sido comprobada por el ingeniero dos décadas antes como soportes para torres de agua fig.,Fue construido mediante el acoplamiento de cestas hiperbólicas cuya forma había sido probada por el ingeniero dos décadas antes como soportes para torres de agua de higos.
"De manera concreta, las unidades y los grupos de investigación de nuestras facultades, en asocio con las unidades de extensión, tienen allí una posible fuente de financiación y recursos que deberá ser explorada mediante la búsqueda de alianzas estratégicas con entidades territoriales, ONG, minorías étnicas, para el mejoramiento de sus condiciones de calidad de vida.","En concreto, las unidades y grupos de investigación de nuestras facultades, asociadas a las unidades de extensión, tienen una posible fuente de financiación y medios que se explorarán mediante la búsqueda de alianzas estratégicas con entidades territoriales, ONG, minorías étnicas, para mejorar sus condiciones de vida."
"Este tipo de encuentro, también conocido como General Panel, fue desarrollado por Konrad Wachsmann y Walter Gropius, quienes introdujeron un conector metálico y un rebaje en 45° a lo largo del marco perimetral del panel, lo que resulta en un encuentro en forma de x para cuatro paneles.","También conocido como Panel General, desarrollado por Konrad Wachsmann y Walter Gropius cuyo desarrollo principal corresponde al conector de metal con el interesante resultado de que el marco del perímetro se reduce en las esquinas a 45° lo que resulta en la unión de 4 paneles para formar un ""X."
El número 92 de ARQ también es excepcional porque se presenta en un nuevo formato más pequeño y con más páginas que reemplaza al que la revista mantuvo desde el número 30 publicado en 1995.,"Este número 92 de ARQ es también excepcional porque se presenta en un nuevo formato -más pequeño pero más grueso- que sustituye al que la revista había mantenido desde el número 30, publicado en 1995."
"Es bien conocido al respecto que una de las impulsoras del feminismo moderno, Betty Frieddan, se oponía a la visibilización de las lesbianas, a las que consideraba “la amenaza lila” del feminismo ; .","Es bien sabido que una de las catalizadoras del feminismo moderno, Betty Friedan, se opuso a la visibilidad de las lesbianas, a las que consideraba la amenaza lila del feminismo."
"Para que éstas pudieran ser colocadas nuevamente en la boca del paciente se les recortó 2 mm de toda la vuelta muscular Figura 6 y los registros cráneo-mandibulares se tomaron con polivinilsiloxano Imprint Bite 3M ESPE, Alemania.","Las grabaciones cranio-mandibulares se tomaron con el silóxano de polivinilo Inprint bite, 3M ESPE, Alemania."
"Centrado en los determinantes de la delincuencia a nivel de barrio y en la eficacia de las respuestas contra este flagelo en Chile, Colombia, Argentina y México, esta edición de Revista INVI ofrece nueve artículos que aportan importantes perspectivas sobre eficacia colectiva y desorganización social en América Latina.","Concentrándose en los determinantes del crimen a nivel de vecindario y en la eficacia de las respuestas al crimen en Chile, Colombia, Argentina y México, este número contiene nueve artículos que proporcionan perspectivas importantes sobre la eficacia colectiva y la desorganización social en el contexto latinoamericano."
"Para los grupos «C» y »D» de ProBase Hot la polimerización también se llevó a cabo por inmersión en agua, variando el ciclo de curado a una temperatura de ebullición durante 40 minutos, siendo este protocolo una de las cuatro alternativas de polimerización que el fabricante establece.","Para los grupos C y D ProBase Hot, la polimerización también se logró inmersionando en agua, variando el ciclo de curado a temperatura de ebullición durante 40 minutos."
"Para mantenerse como actores reconocidos dentro de un mercado global altamente competitivo, los entes tomadores de decisiones en la construcción deben promover estrategias de productividad individuales, que se ajusten a las necesidades comerciales Flanagan et al., 2005. Comisión de Productividad, Gobierno de Australia, 2005.","Para seguir siendo actores de clase mundial en un mercado global altamente competitivo, los responsables de la toma de decisiones en materia de construcción deben promover estrategias de productividad individuales que coincidan con las necesidades de las empresas Flanagan et al., 2005; Comisión de Productividad del Gobierno de Australia, 2005."
"En teoría, esto debería reducir el riesgo de bancos zombis que viven desde hace bastante de los subsidios del gobierno.","En teoría, esto debería reducir el riesgo de que los bancos zombi que viven mucho tiempo vivan con subsidios gubernamentales."
"En estos trastornos, no usar o suspender la medicación supone un riesgo mayor que el de utilizarla.","En estos trastornos, el riesgo de no usar o de dejar de tomar el medicamento es mayor que el de usarlo."
Para conocer el real motivo de este problema se requeriría identificar cuál situación es la que prevalece en cada institución.,"Para conocer el verdadero motivo de este problema, es necesario identificar la situación que prevalece en cada institución."
"43. A pesar de que no sabemos quien demolió el campo, es interesante notar que fue demolido antes de que Pinochet dejara el cargo.","Aunque no sabemos quién derribó el campo, es interesante señalar que fue demolido antes de que Pinochet se fuera del cargo."
"El tema alimentario y de bebidas alcohólicas acaparó el grupo más grande de menciones a la flora, la fauna o los paisajes y faenas.","La mayoría de las menciones a la flora, fauna, paisajes y obras agrícolas se relacionaron con la alimentación y las bebidas alcohólicas."
"De forma general, en la fase de elección y adquisición de los productos de ferralla, se debe prever la compra de los materiales de manera que se adquieran a medida que se necesiten, intentando reducir el exceso de material almacenado.","En general, la fase de selección y compra de productos de barras de acero debe proporcionar la compra de materiales de tal manera que se adquieran según sea necesario, es decir, tratando de reducir el material almacenado."
"Adicionalmente, se verificó que el compromiso y aplicación de valores en la práctica del cuidado es reconocido como parte de la excelencia del profesional de enfermería. Lo perciben como un aspecto propio y característico de la profesión.","Además, se verificó el compromiso y la aplicación de valores en la práctica de la atención, reconocida como parte de la excelencia del profesional de enfermería, que perciben como un aspecto característico de la profesión."
Trespalacios y cols 2010 aislaron e identificaron H. pylori a partir de biopsias gástricas las cuales fueron maceradas en una solución de carbón activada al 1% obteniendo una solución homogénea.,En 2010 Trespalacios et al. aislaron e identificaron H. pylori a partir de biopsias gástricas que fueron maceradas en una solución de carbón activado del 1% para obtener soluciones homogéneas.
"Se aplicó el análisis de componentes principales PCA, por sus siglas en inglés para evaluar las relaciones entre la abundancia de cada grupo de fitoplancton diatomeas, dinoflagelados y flagelados, la concentración de Chla total y <20 μm, la abundancia de especies de copépodos, los índices de diversidad H', d y J' y las variables abióticas temperatura y RUV [UVB + UVA] y RFA.","Se aplicó el análisis de componentes principales PCA para evaluar las relaciones entre la abundancia de cada grupo de fitoplanctones, diatomas, flagelatos y dinoflagelados, la concentración de Chla total y < 20 μm, la abundancia de especies de copépodos, los índices de diversidad H', d y J', y las variables abióticas temperatura y UVR [UVB + UVA] y PAR."
"En los últimos años, las enfermedades fungosas han ocasionado fuertes pérdidas económicas en la producción de diferentes especies hortícolas en México y en el mundo .","En los últimos años, las enfermedades fúngicas han causado grandes pérdidas económicas en la producción de diferentes especies de vegetales en México y en el resto del mundo."
"Las medidas propuestas fueron organizadas en cuatro grupos relacionados con la tenencia, el suelo urbano, la promoción, producción y distribución de la vivienda, así como con el financiamiento, el pago y los subsidios.","Estas medidas se distribuyeron en cuatro grupos: tenencia; tierras urbanas; promoción, producción y distribución de viviendas; y financiación, pagos y subsidios."
"Es necesario invertir en capital humano para aumentar la formación y capacitación de los recursos humanos; se identificó la insuficiencia en financiamiento, escasez de agua y elevados impuestos en el sector.","Además, se requieren inversiones en capital humano para capacitar los recursos humanos.El aumento de la competitividad es un factor primordial en el actual entorno de globalización económica tanto a nivel nacional como regional."
"Desarrollada completamente en Microsoft Access®, ALTICO ha sido diseñada con una única estructura tabular que organiza la totalidad de las estaciones virtuales disponibles para Colombia, presentando para cada una de ellas: número de la estación, cuerpo de agua al que pertenece río, lago, zona inundada, ciénaga, número de la traza satelital, nombre de la estación, coordenadas geográficas, vínculos para la visualización rápida de la estación, vínculo para acceder a los datos que forman la serie temporal y vínculo para visualización de la estación en Google Earth®.","ALTICO, desarrollado en su totalidad en Microsoft Access, ha sido diseñado para tener una estructura tabular única que organice todas las estaciones virtuales disponibles en Colombia, dando los siguientes datos para cada una: número de estación, cuerpo de agua al que pertenece a río, lago, área de inundación, pantano.., número de rastreo de satélite, nombre de estación, coordenadas geográficas, enlaces para una visión rápida de la estación, enlace para acceder a los datos que forman la serie temporal y enlace para visualizar la estación en Google Earth."
"No es fácil y casi tiro la toalla, tantos lastres ya normalizados.",No es fácil y casi me rindo.
Esto puede ampliar el campo de aplicaciones a la hora de acometer la producción de puzolanas reactivas.,Esto puede ampliar los campos de aplicación para la producción de pozzolans reactivos.
"Parecería, a través de sus discursos, que el profesorado se propone un fin genérico, próximo al cuidado, que es el de atender a lo que le va a hacer falta al alumnado, pero su concreción, paradójicamente, pasa por formular fines atentos a principios de equivalencia, atendiendo al mercado y no a las voces singulares de cada alumno y cada alumna.","Parece, a través de sus discursos, que los profesores proponen un orden genérico, cercano al cuidado, que es responder a lo que faltan los estudiantes, pero su realización, paradójicamente, se hace mediante la formulación de objetivos atentos a los principios de equivalencia, en respuesta al mercado y no a las voces individuales de cada estudiante."
"De los métodos de PF, los hormonales fueron los más utilizados con un 60.3% 30.0% inyección y 30.3% la píldora, siguiéndoles los de barrera con 22.9%, donde el preferido es el DIU con 19.1%, y, finalmente, los permanentes con 12.5%, correspondiendo a la ligadura de trompas el mayor aporte con 10.9%.","De los métodos BC, los métodos hormonales fueron los más utilizados con 60,3% de inyección 30% y 30,3% de píldora, seguidos por la barrera 22,9%, con el DIU siendo preferido con 19,1%, y, finalmente, los métodos permanentes con 12,5%, correspondientes a la ligadura tubular con la mayor contribución en 10,9%."
"ERGE como entidad clínica tiene variadas presentaciones 1, 2.","Clínicamente, el ERGE tiene una variedad de presentaciones."
Cuando la lesión contiene grandes cantidades de colágeno se le denomina mixofibroma.,Cuando la lesión contiene grandes cantidades de colágeno se llama mixofibroma.
"Muchos proyectos de transformación han sobrevivido a modas de gobierno porque quienes lo implementan están convencidos de su resultado y no lo ven como un proyecto de un gobernante, sino como su proyecto de vida.",Inmediatamente hablé con el burócrata que impidió el cambio en el programa y le expliqué que su gobierno violaba severamente una ley superior que no podía ser ignorada: la ley de la gravedad.
"Sin embargo, varias lecciones pueden aprenderse de contextos similares y la investigación rigurosa que considera procesos y contextos es de gran valor para áreas de recursos limitados, donde este tipo de investigación puede tener costos prohibitivos 10.","Sin embargo, se pueden aprender varias lecciones de contextos similares y la investigación rigurosa que tiene en cuenta los contextos y los procesos es de gran valor para los entornos de restricciones de recursos, donde este tipo de investigación puede ser prohibitivamente costosa10."
"El IRI obtenido luego de la construcción debe ser similar al de un pavimento de hormigón convencional, el cual depende principalmente del equipamiento y habilidad del contratista.","El IRI obtenido después de la construcción debe ser similar al obtenido por un pavimento de hormigón convencional, que depende principalmente del equipo y las habilidades del contratista."
"Se requiere profundizar en esta línea de investigación a nivel poblacional, en virtud de que los datos del presente estudio solo representan a un sector de la juventud que asiste a escuelas públicas del Estado de Morelos, México; sin embargo, nuestros resultados son de gran utilidad para que el Ministerio de Educación Pública en colaboración con otras instituciones, establezcan medidas de prevención, detección y disminución de abuso sexual.","Este enfoque de investigación debe ser estudiado con mayor profundidad a nivel de la población general, ya que los datos de este estudio representan sólo un sector de los jóvenes que asisten a las escuelas públicas del estado de Morelos, México."
"Ejemplo de dicha confusión se encuentra en un trabajo pionero sobre las coccidiosis de E. R. Becker, publicado en 1934.","Un ejemplo de esta confusión se puede encontrar en un trabajo pionero sobre la coccidiosis de E.R. Becker, publicado en 1934."
"Sin embargo, pocos negarían que fenómenos tales como la delincuencia organizada transnacional el tráfico de drogas, la trata de personas, el contrabando de armas, el blanqueo de capitales y la violencia interpersonal representan una amenaza real para el logro del máximo potencial de desarrollo de individuos y comunidades por igual.","Sin embargo, pocos negarían la amenaza real que los fenómenos como el crimen organizado transnacional - el narcotráfico, el tráfico de personas, el contrabando de armas, el lavado de dinero y la violencia interpersonal - suponen para los individuos y las comunidades para alcanzar su máximo potencial de desarrollo."
