reference,actual
"Se ocupó así de establecer el margen aceptable de variabilidad o grado de dispersión, sea para más hoy sería un IMC>25 o para menos hoy sería un IMC<18, de la media, identificada con la proporción ideal IMC=21.","Así, se propuso establecer el margen aceptable de variabilidad o nivel de dispersión, ya sea en el extremo superior que hoy sería un IMC> 25 o en el extremo inferior que hoy sería un IMC<18 del promedio, identificado como la proporción ideal de IMC=21."
Después de la colocación de los implantes se pue-de alojar una prótesis provisional.,"Después de la colocación del implante, se puede colocar una prótesis dentaria provisional."
"Pero, pese a estas diferencias culturales, en general, existe preferencia por paisajes que contienen ciertos componentes tales como cubierta vegetal, espejos de agua, formas irregulares, poco artificializados, entre otros.","Pero, a pesar de estas diferencias culturales, existe una preferencia general por los paisajes que contienen ciertos componentes como cubierta vegetativa, cuerpos de agua, formas irregulares y bajos niveles de interferencia artificial, entre otros."
"Sin embargo, hasta el momento, ha faltado hacer referencia a un término fundamental y obligatoriamente asociado al reasentamiento, es decir, el concepto de hábitat, el cual se menciona en la definición de Hurtado Isaza cuando escribe ""[El reasentamiento es]...una experiencia de vida que involucra la transformación de la cotidianidad, a partir de un traslado poblacional definitivo, fuera del entorno de permanencia original, cuyo propósito es el mejoramiento de la calidad de vida y, por ende, la construcción o consolidación de un hábitat digno"".","Esta noción es mencionada por Hurtado Isaza: [Reubicación es]... una experiencia de vida que implica la transformación de la vida cotidiana, considerando un desplazamiento definitivo fuera del área original de permanencia, cuyo objetivo es la mejora de la calidad de vida y la construcción de un hábitat decente."
Tratamiento de la Trichomonas vaginalis.,"No hubo diferencia con respecto a los efectos adversos RR 0, 94: 0, 74-1, 1495% CI104 nivel de evidencia: moderado."
"El procedimiento de calibración mediante esta metodología exige calcular el Factor de Seguridad global de diseño Fs,diseño y el Factor de Seguridad global óptimo o requerido Fs,óptimo.",El procedimiento de calibración de esta metodología exige el cálculo del factor de seguridad global Fs del diseño y el factor de seguridad global F óptimo requerido o óptimo.
"Por otro lado, las letrinas de las fincas son compartidas por los habitantes y los trabaj adores jornaleros que no viven dentro de ellas, por lo tanto el uso puede intensificarse y representar otro riesgo para los habitantes de las fincas.","Por otro lado, las letrinas agrícolas son compartidas por los habitantes y los trabajadores casuales que no viven allí, por lo que el uso se intensifica y representa otro riesgo para los habitantes de la granja."
"De hecho, en 2005, Guerrero ocupaba el primer lugar por el número de clubes que representa por encima de las entidades de tradición migratoria tabla 1.","De hecho, en 2005, Guerrero ocupó el primer lugar por número de clubes que representa por encima de los estados de tradición migratoria tabla 1."
"Hacia finales de los noventa, la sardina presentó una mayor dispersión hasta las 200 mn y mantuvo esta distribución amplia durante los años 2000 a 2005, con rendimientos bajos de alrededor de 5000 t.","A finales de la década de 1990, las zonas de pesca se extendían más a 200 nm en alta mar, y esta amplia distribución continuó entre 2000 y 2005, con rendimientos de aproximadamente 5000 toneladas."
"En este caso, al paciente se le administró medicamento no prescrito en la indicación médica.","En esta situación, al paciente se le dio un medicamento que no se le prescribió para la indicación médica."
"Los sujetos pueden demandar los derechos porque se los otorgamos, porque vemos en el otro un sujeto de derechos, porque le reconocemos esos derechos por su condición de ser humano.","Los sujetos pueden exigir derechos porque los concedemos, porque vemos en el otro un sujeto con derechos, y porque reconocemos estos derechos debido a su condición de ser humano."
"Por lo tanto, la distribución de las opciones de respuesta es diferente para cada entrevistado.","Por lo tanto, la distribución de las opciones de respuesta es diferente para cada encuestado."
"La configuración D arroja la mejor aproximación con relación al valor experimental, con un error de 1.64 %.","La configuración D proporciona la mejor aproximación en relación con el valor experimental, con un error o 1,64%."
"El dilema de la acción colectiva predice que un individuo racional que busca maximizar utilidades o bienes mostrará una tendencia a obtener beneficios de los esfuerzos de sus vecinos, mientras que a su vez, otros vecinos se comportarán de la misma forma.","El dilema de la acción de recaudación predice que un residente racional que busca maximizar la utilidad o la riqueza es probable que libere los esfuerzos de sus vecinos, y otros actuarán de la misma manera."
"Para conocer en forma indirecta los valores de la tensión de otros tirantes, sin destapar sus anclajes, se diseño un sistema mecánico-eléctrico capaz de medir las frecuencias naturales de estos tirantes, con lo cual se pueden estimar sus tensiones.","Para poder encontrar indirectamente los valores de tensión de algunos otros filtros sin descubrir sus anclajes, se desarrolló un sistema mecánico-eléctrico que era muy capaz de medir las frecuencias naturales de dichos filtros, permitiendo así la estimación de sus tensiones."
"La colonización de áreas nuevas le permite a una población establecerse en condiciones ambientales más favorables, lo cual es muy evidente en la expansión y contracción de las poblaciones de peces pelágicos menores.","La colonización de nuevas zonas permite a una población establecerse en condiciones ambientales más favorables, lo que se manifiesta claramente en la expansión y contracción de las poblaciones de pequeñas especies pelágicas."
"La creación del INP se logró finalmente en 1908 Decreto de 28 de febrero de 1908, Gaceta de Madrid, 29 de febrero.","La creación de la INP se logró finalmente en 1908 con el Decreto de 28 de febrero de 1908, Gaceta de Madrid, 29 de febrero."
Los barcos se encontraban en esas áreas y permanecían varios días a la vista unos de otros.,Los barcos se encontraron en estas áreas y permanecieron a la vista de los demás durante varios días.
"Así que, parece que ambos puntos fundamentales del programa Stricto senso se están alcanzando, pero para los cursos especialmente el de Maestría aún se lleva más tiempo de lo que debería y el programa de Doctorado se sigue de forma más rígida, de acuerdo a las definiciones propuestas para un curso de postgrado.","Por lo tanto, parece que se cumplen los puntos fundamentales del estrictos sentidos, pero los cursos, especialmente los de maestría, siguen teniendo más tiempo de lo que deberían y el programa de doctorado se adhiere más estrictamente a las definiciones propuestas para un curso de posgrado adecuado."
Esta conformación nos permite pensar que Cuadernos de Contabilidad se está consolidando como un espacio válido y visible para docentes de otras universidades y esperamos seguir consolidándola en ese sentido nacional e internacionalmente.,Este conjunto de artículos nos permite creer que la revista se está consolidando como un espacio válido y visible para los profesores de otras universidades y esperamos continuar fortaleciendo este tema a nivel nacional e internacional.
"Esta categoría está compuesta por prefabricados como: redes para la retención de residuos orgánicos, geotextiles de malla abierta, revestimientos para el control de la erosión y mantas de refuerzo de la vegetación.","Esta categoría se compone de productos preformados, como redes de retención de residuos orgánicos, geotextiles de malla abierta, revestimientos para control de la erosión y alfombras de refuerzo vegetal."
"Este aislamiento, junto con las restricciones determinadas por la falta de potencial participativo marcado por la incapacidad de exigir sus derechos en el país que los acoge, pueden contribuir para establecer una inclusión parcial y marcada por una fuerte tendencia para constituir acciones públicas que promuevan la transformación de las políticas de discriminación positiva enfoque en políticas de discriminación negativa.","Este aislamiento, junto con las restricciones determinadas por la falta de potencial participativo y la incapacidad de exigir sus derechos en el país en el que viven, contribuyen a establecer una inclusión parcial y una fuerte tendencia a construir acciones públicas que transformen las políticas de discriminación positiva en políticas de discriminación negativa."
"Asociación Colombiana de Ingeniería Sísmica 2010, se deja la opción de usar valores de E inferiores, queda únicamente como una simple sugerencia que muchos calculistas nunca usarán.","La Asociación Colombiana de Ingeniería Sísmica 2010 está abierta a la opción de utilizar valores E más bajos, es sólo una sugerencia que muchos estimadores nunca emplearán."
"Para hacer el análisis de variación de costos iniciales de construcción, asociados a las estructuras resultantes de cada combinación de leyes de fatiga, se calculó el costo para un kilómetro de vía con un ancho de 7.3 m. Para esto se determinó la cantidad de m que representa cada material por kilómetro y se multiplicó por su costo unitario en m, Tabla 9.","Para realizar el análisis de variación de los costes primarios de construcción asociados a las estructuras resultantes de cada combinación de leyes de fatiga, se calculó el coste de un kilómetro de vía con una anchura de 7,3 m."
En décadas recientes se han utilizado a los mangles para la remoción de compuestos nitrogenados y fosfatados.,"En las últimas décadas, los humedales de manglares se han utilizado como una opción viable para eliminar compuestos de nitrógeno y fosfato."
Las deformaciones de entrepiso de diseño fueron cercanas a 0.9%.,"Las deformaciones intercorrientes diseñadas fueron cerca del 0,9%."
"El análisis de la información permitió determinar para cada actividad, la información obtenida en la siguiente Tabla, tomando como ejemplo el proceso constructivo columnas:","El análisis de datos permitió determinar cada actividad, considerando como ejemplo el proceso constructivo de las columnas."
"Así la imagen de Jezabel que desdeña a Dios, ha sido usada a través de la historia para desvalorizar a todas las reinas que han dado la más mínima muestra de autonomía con respecto al poder religioso .","La imagen de Jezabel, que despreciaba a Dios, se usó a lo largo de la historia para cuestionar a todas las reinas que mostraban una autonomía mínima con respecto al poder religioso."
"La atención domiciliaria, tanto médica como de enfermería, está por debajo del 5% mensual y ligada con la mayor edad y a la dependencia, en línea con los datos de otros estudios.","Las visitas al médico y a la enfermera en casa son inferiores al 5% de todas las visitas mensuales y están asociadas con la edad avanzada y la dependencia, de manera similar a los hallazgos anteriores."
"En este sentido, es un escenario para compartir visiones y posiciones, en el marco de un proceso de debate y deliberación y en un ambiente de diálogo de saberes para establecer acuerdos colectivos internos y externos al ámbito de las sesiones.","En este sentido, es un espacio para compartir perspectivas y posiciones en el marco de un proceso de debate y de deliberación, en un entorno de diálogo sobre el conocimiento para establecer acuerdos colectivos, tanto dentro como fuera de las sesiones."
La fatiga era una de las causas principales del desperdicio de importantes posibilidades de acumulación.,La fatiga fue una de las principales causas de la pérdida de importantes posibilidades de acumulación.
"Por otro lado, el 50.0% de los hombres declaró asistir al menos una vez al año y el 50.0% restante asistió dos o más veces al año Tabla 2.","Por otro lado, la mitad de los hombres informó tenerlos una vez al año y la otra mitad informó tenerlos dos veces o más al año."
"El médico que me asistió era idiota, no tenía ni los reflejos de una buena matrona de las de antes, de una qabla.","El médico que me ayudó era un idiota, ni siquiera tenía los reflejos de una buena partera de estilo antiguo, los de una gabla."
Dos de los entrevistados acudieron a la lectura corporal y esperaban que la información les ayudara a modificar aspectos personales que no les gustaban.,Dos de los encuestados asistieron a la lectura del cuerpo y esperaban que la información les ayudara a modificar aspectos personales que no les gustaban.
"La meperidina no se debe administrar en dosis repetidas, ya que tiene un metabolito, la normeperidina, con una vida media larga 18 h y que se acumula después de varias dosis y genera excitación del sistema nervioso central manifestada como mioclonías y convulsiones generalizadas.","La meperidina no debe administrarse en dosis repetidas debido a la normaperidina, un metabolito de larga vida media de 18 h que se acumula después de varias dosis y produce excitación del sistema nervioso central que resulta en manifestaciones como mioclones y convulsiones generalizadas."
"Estas acciones que apuntan a determinantes poblacionales – como el empoderamiento de las mujeres – son de especial interés ya que en el país persisten grandes diferencias en las relaciones de poder entre hombres y mujeres, con marcado impacto en la salud.","Estas acciones dirigidas a los determinantes de la población, como el empoderamiento de las mujeres, son de especial interés porque todavía hay grandes diferencias en las relaciones de poder entre hombres y mujeres en el país, con un impacto importante en la salud."
"Publicado por Elsevier España, S.L. Todos los derechos reservados.",Resultados: La preparación es imprescindible en situaciones en las que se espera sangrado masivo.
"No exceder el costo del metro cúbico aprobado para el Valle de México $64.76/m, lo que significa que el costo por litro sería de 6.5 centavos.","No exceder el costo del metro cúbico aprobado para Valle de México $64,76 /m, lo que significa que el precio por litro sería de 6,5 centavos."
"Hace poco se escuchó que había redadas, pero mi prima que es nacida aquí, me dice ""tú no te preocupes, tú no pareces ΄ilegal΄, tú pareces american citizen"" y sí [...] yo me he dado cuenta que en lo que más se fijan ellos [la migración] es en la personalidad de la gente, en su estilo, eso me he dado cuenta yo, porque he visto que los que agarran son gentes así pobres, que viene así sencillamente vestida, que se ve que vienen del pueblo [...]","Te ves como un 'ciudadano estadounidense', y sí [...] me di cuenta de que lo que ellos [las autoridades de inmigración] se centran en es la personalidad de alguien y su forma de vestirse. Me di cuenta de esto porque he visto que atrapan a las personas pobres, a las personas que están vestidas con modestia, a las personas que se ven procedentes de pueblos pequeños [...]."
"Por esta razón la realización de revistas de acceso libre al conocimiento científico, como Chungara, debería multiplicarse para el beneficio de las nuevas generaciones del planeta Watson et al. 2010.","Por esta razón, más revistas deberían seguir el ejemplo de otras que ofrecen libre acceso al conocimiento científico, como Chungara, para el beneficio de las generaciones futuras en este planeta Watson et al."
Se realizó una encuesta transversal en internet con una muestra de conveniencia.,Se realizó una encuesta en línea transversal con una muestra de conveniencia.
"Resultados similares obtuvo Alexopoulos et al. quien encontró una relación directa de presencia de dolor en cuello y espalda baja, en los estudiantes que no toman descanso después de la atención odontológica.",Resultados similares fueron obtenidos por Alexopoulos et al. que encontraron una relación directa para la presencia de dolor en el cuello y la parte inferior de la columna vertebral en los estudiantes que no toman un descanso después de prestar servicio dental.
"La variable de la distancia log d ij presenta un signo negativo, esto implica que la distancia tiene un impacto negativo sobre la migración, lo que indica claramente que los trabajadores mexicanos son renuentes a desplazarse hacia regiones muy alejadas; esto se debe principalmente a que los costos de migrar son más altos a distancias mayores.","La variable de distancia logdij presenta un signo negativo, lo que significa que la distancia tiene un impacto negativo en la migración, un claro signo de que los trabajadores mexicanos se muestran reacios a mudarse a regiones muy lejanas."
La REM asistida por inyección también llamada polipectomía asistida por solución salina se usa frecuentemente para resecar grandes pólipos planos en el colon.,"La EMR asistida por inyección, también llamada polipectomía asistida por salinas, se utiliza a menudo para resetar grandes pólipos planos en el colon."
El número de pacientes trasplantados de hígado en el mundo y en nuestro país va en aumento así como también las complicaciones asociadas.,"A medida que aumenta el número de pacientes con trasplante de hígado en todo el mundo y aquí en nuestro país, también ha aumentado el número de complicaciones asociadas con estos trasplantes."
"Se encontró que los principales temas publicados en los artículos fueron: CGG Contabilidad de Gestión, con el 28,10%, Educación e Investigación de Contabilidad, con el 8,50% y el de Contabilidad Financiera, con el 7,84%.","Los autores encontraron los siguientes temas principales en los artículos que se publicaron: contabilidad de gestión de MA, con 28,10%; educación y investigación contable, con 8,50%; y contabilidad financiera, con 7,84%."
"El lenguaje constituye el mejor ejemplo de sistema simbólico, pues a partir de él se construye colectivamente la realidad social.","El lenguaje es el mejor ejemplo de sistema simbólico, ya que la realidad social se construye colectivamente a partir de él."
Otro aspecto que coadyuva a confirmar la ausencia de comunicación efectiva e información adecuada fue la reiterada solicitud de información de los pacientes a lo largo de la entrevista:,Otro aspecto que también confirmó la falta de comunicación efectiva e información adecuada fue que los pacientes solicitaron información repetidamente durante la entrevista:
"Así, por ejemplo, en Bangladesh, se han denunciado talleres semiclandestinos donde operan trabajadores con sueldos de miseria - tan bajos como de USD 120 al año -, en sistemas de tres turnos para sumar, bajo pedido, miles de ""clicks "" o ""hits "" a los conteos de páginas de la Internet de ciertos productos y para fabricar, de ese modo, una fraudulenta apariencia de popularidad ""en-línea"", que se consigue pagando US 15 por cada 1000 pulsaciones en ""me gusta"" o ""muy bueno"".","Por ejemplo, se han reportado tiendas semi-clandestinas en Bangladesh, donde los empleados trabajan en condiciones miserables, por salarios mínimos - tan bajos como $ 120 por año - en sistemas de tres turnos. Producen bajo petición pagada miles de clics o hits para contadores de páginas de Internet que falsamente aumentan las tasas de aceptación de una variedad de productos y, por lo tanto, fabrican una apariencia fraudulenta de popularidad en línea. Pagando a los trabajadores de estas llamadas ""clic farms"" $ 15USD por cada 1.000 pulsos en ""Me gusta"" o ""Muy bien"" las mercancías pueden mostrar alta demanda del consumidor."
"En el siglo II d. C., en la época de Adriano, el nivel de la zona se elevó notoriamente debido a las inundaciones y subidas del Tíber, por lo que el altar terminó enterrado hasta la mitad de su altura y debió ser rodeado por un muro de albañilería.","En el siglo II dC, en la época de Adriano, el nivel del área se elevó notoriamente debido a la inundación del río Tíber por lo que el altar estaba a medio camino enterrado y debe haber sido rodeado por una muralla de mampostería."
Otras técnicas sólo cierran el defecto y dejan cicatrices que cruzan el labio.,"Otras técnicas sólo cierran el defecto, dejando cicatrices que cruzan el labio."
"La cantidad de fluoruro liberado fue mayor las primeras 24 horas, declinó en el segundo día, y gradualmente disminuyó a lo largo del estudio.","Las cantidades de fluoruro liberado fueron mayores durante las primeras 24 horas, para luego disminuir en el segundo día; luego disminuyeron gradualmente a lo largo del período de tiempo del estudio."
"En esta fase, se recopilaron datos básicos como precio de venta declarado por el contribuyente, superficie total y privada, año de término de la edificación y nivel de calidad de la construcción.","En esta fase se recogieron datos básicos, como el precio de venta declarado por el contribuyente, el área de suelo privada y total, el año de finalización del edificio y el nivel de calidad de la construcción."
"Más concretamente, nuestros objetivos se centraron en analizar cómo las enfermeras se representan su rol como académicos de enfermería, cuáles son sus concepciones, sus estrategias, y los sentimientos involucrados en los procesos de enseñanza y aprendizaje, y en la investigación en enfermería.","En concreto, nuestros objetivos fueron analizar cómo las enfermeras representan su papel como académicas de enfermería, sus conceptos, estrategias y sentimientos involucrados en los procesos de enseñanza y aprendizaje y en la investigación de enfermería."
"A pesar de la crisis nacional que se vivió ese año, los socios habían “dado constantemente el ejemplo de cómo se [alcanzaba] la gloria caminando por los senderos espinosos de la ciencia y no vacilaron en permanecer firmes en su pensamiento y proseguir en sus nobles y laboriosas tareas” mientras se definía el destino de la nación Jiménez, 1867-1868, p.369.","A pesar de la crisis nacional que ocurrió ese año, los miembros habían dado constantemente un ejemplo de cómo alcanzar la gloria caminando por los caminos espinosos de la ciencia y no habían vacilado sino que se mantuvieron firmes en su pensamiento y continuaron con sus nobles y laboriosas tareas mientras se decía el destino de la nación Jiménez, 1867-1868, p.369."
"Ex migrante del Programa Bracero. Datos de la AGEB 038-9 INEGI, 2002, que abarca 100 por ciento del territorio de San Juan Unión, muestran que la población económicamente activa es de tan solo 12.7 por ciento. Predomina la actividad primaria, misma que absorbe 59 por ciento de la fuerza laboral. No obstante, el abandono del campo es evidente.","Los datos del AGEB 038-9 INEGI, 2002, que comprende el 100 por ciento del territorio de San Juan Union, muestran que la fuerza laboral es sólo el 12,7 por ciento; la actividad predominante es la principal, que comprende el 59 por ciento de la fuerza laboral; sin embargo, el abandono de los campos es evidente."
Funciona así como un colonizador biológico: pone a las células vegetales a trabajar para satisfacer las necesidades de Agrobacterium .,Así que funciona como un colonizador biológico: hace que las células de la planta trabajen para satisfacer las necesidades de Agrobacterium.
"Otros tumores mixoides además del angiomiofibroblastoma son los lipomas, mixomas de tipos intramuscular y yuxtaarticular, leiomioma mixoide, y la fibromatosis pélvica, al igual que lesiones malignas como el sarcoma mixoide de bajo grado liposarcoma mixoide y el histiocitoma fibroso maligno mixoide de bajo grado mixofibrosarcoma 3-5, 7, 10, 12.","Además del angiomyofibroblastoma, otros tumores mixoides son lipomas, mixomas de tipo intramuscular, mixoide leiomyoma juxta-articular, fibromatosis pélvica, mixoide sarcoma liposarcoma mixoide sarcoma maligno de bajo grado y mixoide fibroso histiocytoma mixofibrosarcoma 3-5, 7, 10, 12."
"Este trabajo está basado en la investigación desarrollada en el marco de la tesis doctoral ""Legitimación de la energía nuclear en España: el Fórum Atómico Español 1962-1979"" elaborada por Luis Sánchez Vázquez y dirigida por Alfredo Menéndez-Navarro en el año 2010.","El estudio se basó en la investigación realizada como parte de la tesis doctoral ""Legitimación de la energía nuclear en España: el Fórum Atómico Español 1962-1979"" Legitimación de la energía nuclear en España: el Foro Atómico Español, escrito por Luis Sánchez Vázquez y dirigido por Alfredo Menéndez-Navarro en 2010."
"Las costumbres frente a las relaciones de pareja están permeadas por la fuerte moral religiosa heredada, y su hibridación con concepciones culturales sobre las mujeres.",Las costumbres comparadas con las relaciones de pareja están imbuidas de las fuertes morales religiosas heredadas y su hibridación con las ideas culturales sobre las mujeres.
"recomiendan almacenar el producto empacado en bolsas de polietileno, polipropileno o cajas de cartón en espacios protegidos del sol a temperaturas máximas de 15-20 °C y una humedad ambiental máxima de 60% y bajo estas condiciones el producto puede conservarse por 12 a 18 meses.","recomienda almacenar el producto envasado en bolsas de polietileno o polipropileno o en cajas de cartón en espacios protegidos del sol a temperaturas máximas de 15-20 oC y una humedad ambiente máxima del 60% y, en estas condiciones, el producto podría conservarse durante un máximo de 12 a 18 meses."
