reference,actual
"El método químico de Frattini representa la cantidad máxima de hidróxido de calcio con ia que una puzolana se puede combinar, esta reacción depende de diferentes factores como ia naturaleza y proporción de las fases activas del material puzolánico y su superficie específica, así como también de ia relación cal-puzolana y ia temperatura de reacción.","Esta reacción depende de diferentes factores, como la naturaleza y la relación de las fases activas del material pozzolánico y su superficie específica, así como la relación cal-pozzolan y la temperatura de reacción."
"En Embase, la búsqueda con las listas bibliográficas de otras publicaciones permitió encontrar otros 12 estudios, pero esos escritos no se referían al tema, o no cumplían los criterios de inclusión o no eran nuevos respecto a PubMed.","En Embase, la búsqueda con la lista bibliográfica de otras publicaciones nos permitió encontrar otros 12 estudios, pero estos escritos no se referían al tema, o no cumplirían los criterios de inclusión o eran nuevos en relación con PubMed."
A partir de este modelo fue posible identificar los distintos grupos de riesgo generados.,"A partir de este modelo, se pudieron identificar los diferentes grupos de riesgo generados."
Se trata de una locación histórica con un emplazamiento privilegiado en una de las zonas turísticas más importantes de la ciudad de Berlín.,Es un entorno histórico con una posición privilegiada en una de las zonas turísticas más importantes de la ciudad de Berlín.
Esta ampliación de búsqueda fue debida a la escasa literatura encontrada que realizase una relación directa entre la MGF y la consecución de los Objetivos de Desarrollo del Milenio.,La expansión de nuestra búsqueda se llevó a cabo debido al bajo número de lecturas que vinculan explícitamente la mutilación genital femenina y el logro de los Objetivos de Desarrollo del Milenio.
"Se citó en siete días para valoración, percatándose de un adecuado proceso de cicatrización Figura 16.","Se le pidió al paciente que regresara después de siete días, en ese momento se observó un proceso de curación adecuado en la Figura 16."
"Así, para Herz, la totalidad de estas relaciones es la espacialización del campo Herz, 2008.","Así, para Herz, toda la relación es la espacialización del campo Herz, 2008."
Elbashir et al. 2008 mencionan que resulta poco apropiado usar medidas contables como la rentabilidad de la empresa o el retorno de la inversión en la medición del desempeño del negocio con base en herramientas como los sistemas de procesamiento transaccional o los sistemas de soporte a las decisiones.,"Elbashir et al., 2008 han mencionado que no es muy apropiado utilizar medidas contables como la rentabilidad de la empresa o el rendimiento de la inversión al medir el rendimiento de la empresa basándose en herramientas como sistemas de procesamiento de transacciones o sistemas de apoyo a la toma de decisiones."
Diámetro de los árboles a la altura de 1.30 m DAP m = Todos los árboles se ubicaron por clases de diámetro,"Diámetro de los árboles a una altura de 1,30 m DBH m = todos los árboles se distribuyeron por clase de diámetro"
"En el Cuadro 1 se describen las condiciones de precipitación y temperatura que prevalecieron en el sitio durante el periodo de evaluación, de agosto de 2014 a febrero de 2015.","Las condiciones de precipitación y temperatura que prevalecen en el sitio durante el período de evaluación, de agosto de 2014 a febrero de 2015, se describen en el cuadro 1."
" Ecuación 3: nombre de las universidades y topónimos correspondientes a ciudades brasileñas, limitando aquellos que pudieran generar confusión con el de otros países."," Ecuación 3: nombre de las universidades y nombre correspondiente de las ciudades brasileñas, excluyendo aquellas que podrían crear confusión con las ciudades de otros países."
"Adicionalmente, se encontró un estudio hecho en el RESA Simeprodeso de Monterrey, Nuevo León, en el que se empleó el modelo Usepa E-PLUS, el cual es diferente a los anteriores, usándose también una metodología distinta para evaluar la recuperación de biogás LFG Consult, 2007.","Un estudio del vertedero sanitario SIMEPRODESO en Monterrey, Nuevo León, utilizó el modelo ""USEPA E-PLUS"", que es diferente de los anteriores y también utilizó una metodología diferente para evaluar la recuperación de gas de vertederos LFG Consult, 2007."
"Para esto se recopiló la bitácora de esta obra, en la cual se explica cada una de sus etapas y algunos de sus imprevistos.","Por esta razón, se ha elaborado el diario del sitio de trabajo, que explica cada etapa y algunas situaciones imprevistas."
"Los efectos hipotensores, la reversión a la circulación neonatal y la menor depuración que produce una sedación prolongada en neonatos siguen siendo obstáculos para el uso de TIVA en este grupo etario .","Los efectos hipotensivos, la reversión a la circulación neonatal y la disminución del clearance que causa la sedación prolongada en los recién nacidos siguen siendo obstáculos para el uso de TIVA en este grupo etario."
"Al examen físico FC: 78 FR: 18, en buen estado general, afebril, hidratada, con máculas hiperpigmentadas en región facial y en labio inferior.",El examen físico mostró HR: 78 y RR: 18.
"En el caso 1 se demostró la presencia de eosinófilos en el colon, con un recuento mayor a 60 eosinófilos por campo de alto poder, confirmando la enfermedad.","En el caso uno, el recuento de eosinófilos por campo de alta potencia fue superior a 60, lo que confirma la enfermedad."
"En ensayos experimentales de este tipo, las componentes de esfuerzos no nulas están contenidas en el plano de la viga describiendo un estado plano de esfuerzos, el concreto presenta deformaciones pequeñas respondiendo a la teoría de las deformaciones infinitesimales y el estado de flexión genera la aparición de una sola fisura aproximadamente vertical.","En tales pruebas experimentales, los componentes de tensión no vacíos se encuentran en el plano del haz que describe un estado plano de tensión; el concreto muestra una pequeña tensión que responde así a la teoría de las tensiones infinitesimales y, la condición de resistencia flexionaria provoca la excitación de una sola grieta vertical aproximadamente."
"En conclusión y a partir de esta discusión estética propondremos un atisbo del alcance ético del diseño, la arquitectura y la planificación en el mundo contemporáneo.","En conclusión y derivados de esta discusión estética propondremos un vistazo al alcance ético del diseño, la arquitectura y la planificación en el mundo contemporáneo."
"Por eso, lejos de poder considerarse como arquetipos metafísicos, los cuatro tipos cuvierianos - Vertebrata, Molusca, Articulata y Radiata - deben entenderse como tipos fisiológicos u organizacionales Ghiselin, 1983, p.127; Papavero, Llorente-Bousquets, 1994, p.129; Guillo, 2003, p.38; ellos son los cuatro modos fundamentales de la economía animal Cuvier, 1817, p.57 y ss. Cualquier animal que realmente pueda existir, o haber existido, no podrá ser otra cosa que una variación sobre uno de esos cuatro temas fundamentales Cassirer, 1948, p.162 y la clasificación exhaustiva de todos los seres alguna vez existentes constituiría un repertorio de todas las variaciones posibles dentro de esos planos básicos Caponi, 2008c, p.39.","Por lo tanto, lejos de ser arquetipos metafísicos, los cuatro tipos de Cuvier - Vertebrata, Mollusca, Articulata y Radiata - deben entenderse como tipos fisiológicos o organizativos Ghiselin, 1983, p.127; Papavero, Llorente-Bousquets, 1994, p.129; Guillo, 2003, p.38; son los cuatro modos fundamentales de la economía animal Cuvier, 1817, p.57 y ff. Cualquier animal que realmente pueda existir, o haya existido, solo puede ser una variación en uno de esos cuatro temas fundamentales Cassirer, 1948, p.162 y la clasificación exhaustiva de todos los seres que alguna vez hayan existido constituiría un repertorio de todas las variaciones posibles dentro de esos planos básicos Caponi, 2008c, p.39."
"La población de referencia estuvo conformada por aquellos pacientes adultos, atendidos en el Hospital El Tunal de la ciudad de Bogotá, con una población de estudio conformada por aquellos pacientes que fueron sometidos a la realización de CPRE en la Unidad de Gastroenterología durante el periodo comprendido entre enero del 2009 y agosto del 2011.",La población de muestras se compuso de pacientes adultos que habían sido sometidos a ERCP en la Unidad de Gastroenterología del Hospital El Tunal de Bogotá entre enero de 2009 y agosto de 2011.
"La mezcla utilizada para la confección de probetas es un concreto asfáltico en caliente del tipo convencional con tamaño máximo de 19 mm, la cual es caracterizada mediante las exigencias dispuestas en el Pliego de Especificaciones Técnicas Generales de la Dirección Nacional de Vialidad, en su sección D VIII.","Los especímenes de ensayo fueron fabricados con hormigón asfalto de mezcla caliente convencional con un tamaño máximo de 19 mm, que se caracteriza por los requisitos establecidos en las especificaciones técnicas de la Genera! del Departamento Nacional de Carreteras de Argentina, en la sección D VIII."
"La relevancia de la obra escrita de Efraím Hernández Xolocotzi radica no sólo en su gran extensión, sino también en la diversidad de temas abordados y sobre todo en la profundidad y detalle del análisis desde distintas perspectivas de la complejidad que tiene la pequeña agricultura y las tecnologías tradicionales, para las cuales la Revolución Verde no tenía opciones socialmente viables que ofrecer.","2013. La importancia de la obra escrita de Efraím Hernández Xolocotzi radica no sólo en su extensión, sino en la diversidad de temas abordados y en particular en la profundidad y detalle del análisis, desde diferentes perspectivas, de la complejidad que tienen la agricultura a pequeña escala y las tecnologías tradicionales, para las cuales la Revolución Verde no tenía opciones socialmente viables para ofrecer."
"No se encontraron investigaciones colombianas sobre la temática, por lo que se hace un llamado a la reflexión y al apoyo de estudios sobre la diversidad cultural presente en nuestro país, abriendo caminos para facilitar el diálogo de saberes entre los profesionales de enfermería y los saberes de los sujetos de cuidado, lo cual contribuirá a mejorar la calidad de la asistencia de los servicios a los usuarios.",Reconocimientos: Los autores agradecen a las enfermeras Ana Elvi Lozano y Leidy Olmos su contribución durante la primera fase de este trabajo.
"Al formar parte de un club, un caballero elegía pertenecer a un tipo particular de sociedad y aceptaba una manera predefinida de comportarse con sus pares.","Al convertirse en miembro de un club, un caballero elige una sociedad en particular y acepta adoptar una forma de comportarse en relación con sus compañeros."
"Es necesario frenar el proceso de desindustrialización e impulsar el desarrollo industrial para crear mejores trabajos, mayores exportaciones y reducir la desigualdad.","Es necesario frenar el proceso de desindustrialización y promover el desarrollo industrial para crear mejores puestos de trabajo, aumentar las exportaciones y reducir la desigualdad."
"Sin embargo, debido a lo infrecuente de esta condición se requerirían de estudios multicéntricos y prospectivos para resolver estos problemas.","Debido a la rareza de esta condición, se requieren estudios prospectivos y multicéntricos para resolver estos problemas."
"Esta situación está agravada por el hecho de que, contrario a Norteamérica, en Sudamérica el registro arqueológico de la transición Pleistoceno Holoceno se caracteriza por una aparente mayor variabilidad regional de la tecnología lítica.","Esta situación se agrava por el hecho de que, a diferencia de América del Norte, en América del Sur el registro arqueológico de la transición del Pleistoceno al Holoceno se caracteriza por una aparente mayor variabilidad regional en la tecnología lítica."
"Se establece que no puede rescindirse del contrato de trabajo a la mujer por razón de su gravidez, se prohíbe el trabajo de las embarazadas seis semanas antes y seis semanas después del parto, período en el que la asalariada tendrá derecho al salario íntegro, se reglamentan dos descansos de media hora cada uno para amamantar al propio hijo y se promueve la instalación de lactarios dentro de los ámbitos fabriles.","Se estableció que el contrato de una mujer no podía ser rescindido debido al embarazo y se prohibió a las mujeres embarazadas trabajar seis semanas antes y seis semanas después del parto, durante el cual la empleada tiene derecho a su salario completo; se prescribieron dos descansos de media hora para que las trabajadoras pudieran amamantar a sus hijos y se alentó la creación de salas para amamantar en las fábricas."
"Se han realizado múltiples estudios para evaluar la relación entre diferentes estadios de maduración ósea, como el de Robinow y colaboradores 1942, que encontró una relación muy baja entre los estadios carpales y la dentición.","Se han realizado varios estudios para evaluar la relación existente entre las diferentes etapas de maduración ósea, como fue el caso de Robinow & al 1942, quien encontró una relación muy baja entre las etapas del carpo y la dentición."
"El sugammadex parece ser, por la evidencia publicada hasta el momento, el medicamento más adecuado para tal propósito.","Sugammadex parece ser, basándose en la evidencia publicada hasta la fecha como el mejor medicamento para este propósito."
"No, porque en ese caso se le tendría que imputar el mismo mecanismo de adhesión a los latinos que votaron en contra.","Si así fuera, los latinos que votaron en contra de ello habrían pensado en los mismos mecanismos."
"Si bien las urbanizaciones cerradas no son un elemento nuevo en el paisaje urbano, y algunas ciudades de América Latina ya contaban con este tipo residencial en la primera mitad del siglo XX, la característica más sobresaliente en la actualidad se relaciona con su desarrollo y establecimiento dentro del mercado inmobiliario como un producto exitoso, y buscado por varios grupos sociales y aun por aquellos que si bien no pueden acceder a ellos por cuestiones de ingresos insuficientes, buscan todas las formas posibles para acceder a ellos aun si esto significa adquirir grandes deudas financieras.","A pesar de que las comunidades cerradas no constituyen un nuevo elemento del paisaje urbano -este tipo de vivienda ya existía en algunas ciudades latinoamericanas en la primera mitad del siglo XX- su característica más importante está relacionada con su desarrollo y presencia en el mercado de la vivienda.Estas comunidades cerradas se consideran un producto exitoso y el objetivo de un número importante de grupos sociales, incluidos aquellos que, a pesar de no tener suficientes recursos financieros, aspiran a vivir en estos espacios incluso si dicho esfuerzo implica serias deudas financieras."
Nuevas demandas sobre el Seguro de Accidentes del Trabajo,Nuevas solicitudes de seguro por accidente laboral
"En 1994, después de 90 años, se creó la garita II ""Nuevo Mexicali"" a 12 km al oriente de la primera.","En 1994, después de 90 años, se construyó el puerto de cruce ""Nuevo Mexicali"", a 12 km al este del primero."
"Adicionalmente se instrumentó cada viga con deformímetros electrónicos tipo LVDT a media altura y en la altura total, con el fin de registrar los desplazamientos de las probetas con respecto al tiempo.","Además, cada haz fue suministrado con transductores electrónicos de tipo LVDT en altura media y altura total, con el objetivo de registrar los desplazamientos de las juntas en relación con el tiempo."
Uno de ellos fue el Proyecto Cantarell orientado a mejorar su infraestructura y mantener su presión para elevar su producción mediante la inyección de nitrógeno.,"Uno de ellos fue el Proyecto Cantarell, que tiene como objetivo mejorar su infraestructura y elevar los niveles de producción mediante la inyección de nitrógeno."
"Entre los factores individuales destacan en muchos estudios los antecedentes de violencia en la familia del varón sobre todo el hecho de haber visto golpear a su propia madre y el abuso del alcohol por parte de éste Johnson, 1996.","Entre los factores individuales, los casos anteriores de violencia en la familia del hombre se destacan en muchos estudios sobre todo el hecho de haber visto a su madre ser golpeada y el abuso de alcohol por el padre Johnson, 1996."
"El despertar del paciente ocurre cuando tenemos 0,1 CAM de sevofluorano.","El paciente se despierta con un MAC de 0,1 de sevofluoreno."
"Basados en el perfil hemodinámico del ingreso debemos considerar la reanimación retardada, hasta tener control vascular del sitio de sangrado, con identificación temprana de los signos y síntomas de hipoperfusión o shock.","Sobre la base del perfil hemodinámico en el momento de la admisión, se debe considerar una reanimación tardía hasta que se alcance el control vascular del lugar de sangrado, con la identificación temprana de signos y síntomas de hiperfusión o shock."
"A partir de aquí y a través de una reconstrucción de nuestras praxis, crear nueva masa crítica de profesionales que trascienda y explicite que otra aproximación al cuidado es posible.","Basándose en estos cambios, los profesionales pueden reconstruir su práctica, crear nuevas masas críticas transcendentes hacia otros posibles enfoques de atención."
"En lo referente a las metodologías empleadas en las investigaciones acerca de la PSLT, un hallazgo interesante de este estudio corresponde a los paradigmas de investigación sobre PSLT identificados en Brasil, país que además de ser el mayor investigador en el área en la región de América Latina y el Caribe, logra un equilibrio en cuanto al desarrollo de estudios desde el positivismo y la sociología comprensiva.","Es interesante señalar que en Brasil, que representa la mayoría de los estudios realizados en América Latina y el Caribe, los resultados de este estudio muestran un equilibrio equitativo en el uso de enfoques de investigación positivos y alternativos."
"Su vida media es de 8-20 horas en circulación, la cual aumenta al entrar en tejidos infectados o inflamados.","La vida media es de 8 a 20 horas en circulación, lo que aumenta al entrar en tejidos infectados o inflamados."
Y su falsedad deriva justamente de haber aceptado la separación de hechos y valores; de haber dejado pasar la peligrosa idea de que los valores con suerte son convenciones y los hechos parte de o inclusive la realidad.,"Y su falsedad deriva precisamente de haber aceptado la separación entre hechos y valores, de haber permitido la peligrosa idea de que los valores son meros convenciones y los hechos son parte o incluso la realidad misma."
Hace varios años se otorgaba el alta hospitalaria después de las 24 horas de haber sido operados.,"Cabe destacar que el bloqueo anestésico fue realizado en todos los casos por residentes de anestesiología, siendo instruido por anestesiólogos con gran experiencia en el uso de mamoplastia de grandes bloques, colecistectomía abierta, etc."
Se verifican macroscópicamente bordes óseos libres de lesión y se suturan los tejidos con sutura ácido poliglicólico 3 ceros.,"Macroscopicamente, se verificaron los límites libres de lesiones, y los tejidos se suturaron con suturas de ácido poliglicólico triple cero."
"Por lo tanto, se requiere de nuevos estudios para buscar estos patógenos.","Por lo tanto, se requieren nuevos estudios para buscar estos patógenos."
"De todas maneras, el laboratorio no rechaza ninguna muestra y todas se ingresan a la fase analítica.","De todos modos, el laboratorio no rechaza ninguna muestra y entran todas en la fase analítica."
"Un pago anticipado se debiera efectuar a los contratistas, por un valor igual al costo de materiales que se emplearán en el proceso constructivo.",Se debe pagar un anticipo a los contratistas que sea igual al coste de todo el material que se supone que se utilizará en el proceso de construcción.
"Estos hallazgos sugieren que el manejo endoscópico conservador es efectivo y seguro, ningún paciente tuvo complicaciones endoscópicas o necesidad de hospitalización.",Estos hallazgos sugieren que el tratamiento endoscópico conservador es eficaz y seguro.
"Ésta ha de ser la información vinculada con el tratamiento farmacológico, que es el que habitualmente se utiliza; sin embargo, también hay psicoterapias efectivas que deberían de ser comunicadas.","Esta debe ser la información relacionada con el tratamiento farmacológico, que es el que se utiliza con frecuencia; sin embargo, también hay psicoterapia eficaz que debe comunicarse."
"Sin embargo, cuando ocurre de manera imprevista, la aplicación de estrategias como el código rojo ha demostrado resultados positivos.","Sin embargo, cuando la hemorragia postparto ocurre inesperadamente, seguir ciertas estrategias como el código rojo ha demostrado ser positivo."
"Un grupo de tamaño considerable, casi un tercio de los encuestados 30.3%, expresa actitudes positivas para ambos actores.","Un grupo considerable, casi un tercio de los encuestados, 30,3%, expresa una actitud positiva tanto sobre la gobernanza formal como sobre los don."
"Los adolescentes de SM y altos son, en gran medida, ND 2.0 expertos, ya que despliegan usos más complejos además de los lúdico-comunicacionales.","Los adolescentes de los sectores de MIS y de altos ingresos son, en su mayoría, expertos en DNs 2.0, ya que utilizan usos más complejos que los lúdicos-comunicacionales."
Con el fin de mejorar la evidencia se requieren estudios que incluyan análisis de subgrupos específicamente para las trabajadoras sexuales y para otro tipo de poblaciones vulnerables.,"Se requieren estudios que incluyan análisis de subgrupos para mejorar las pruebas disponibles, específicamente para las trabajadoras sexuales y otras poblaciones vulnerables."
Se puede interpretar los resultados de la instrumentación estableciendo modelos y criterios para explicar el comportamiento estructural de la represa.,Interpretar los resultados de la instrumentación se puede hacer estableciendo modelos y criterios para explicar el comportamiento estructural de la presa.
"Nuestra mortalidad en la UCI y en el hospital correspondiente a los 392 pacientes tratados únicamente con SLED fue del 33,7 y del 44,9%, respectivamente.","Nuestra mortalidad en la UCI y en el hospital en esos 392 pacientes tratados únicamente por SLED fue del 33,7% y del 44,9%, respectivamente."
"Con las primeras, se invita al planteamiento de hipótesis y al cuestionamiento de posibles comportamientos de hechos o fenómenos líneas, 1:255; 1:288; con las causales, se exige la presentación de pruebas para apoyar afirmaciones líneas, 1:257; 1:262, y con las últimas, las de generalización, se pide la relación del contenido de la participación con el concepto analizado líneas: 1:328; 1:330.","Las preguntas predictivas invitan a la propuesta de hipótesis y al cuestionamiento de posibles comportamientos de hechos o fenómenos líneas 1:255; 1:288; preguntas causales requieren presentar evidencia para apoyar las líneas de afirmaciones, 1:257; 1:262; preguntas de generalización piden la relación entre el contenido de la participación y el concepto líneas analizadas: 1:328; 1:330."
"En ese caso, para determinar la trayectoria o la órbita de un cuerpo celeste se utilizaban diversas mediciones más o menos aproximadas, definiéndose que el valor medio de esas mediciones, obtenidas a partir de observaciones realizadas con instrumentos diferentes, daría el trayecto real de movimiento de los cuerpos celestes.","En astronomía, para determinar la trayectoria o órbita de un cuerpo celeste, se toman varias medidas más o menos aproximadas, y el valor promedio de esas mediciones con diferentes instrumentos se define como la trayectoria real de los cuerpos celestes."
6 Agradecimientos,6 Reconocimiento
El tiempo quirúrgico fue aproximadamente de 10 minutos.,"El tiempo de cirugía fue de aproximadamente 10 minutos, cuando se completó el procedimiento, se prescribió analgésico tipo nimeluside de 100 mg cada 24 horas, no se utilizó cobertura de antibióticos."
"El miedo a la muerte y el miedo al proceso de morir propio, se correlacionaron significativamente con la sub-escala de Percepción emocional r 0,169; p 0,022; r 0,028 y r 0,25; p 0,005; r 0,06 respectivamente.","El miedo a la propia muerte y al proceso de muerte se correlacionaron significativamente con la subescala de percepción emocional r 0.169, p = 0.022; r 0.028 y r 0.25, p = 0.005, r 0.06, respectivamente."
"La demora en obtener los resultados en las pruebas de coagulación, puede ser un iniciador, para aplicar el protocolo de transfusión en emergencias 34.",El retraso en la obtención de los resultados de las pruebas de coagulación puede ser el origen de la aplicación del protocolo de transfusión de emergencia 34.
"De manera breve, a continuación se listan los principales puntos por los cuales el sector de la construcción es considerado como uno de los más complicados en cuestiones de seguridad e higiene:",A continuación se muestra una breve lista de puntos que indican por qué el sector de la construcción es designado como una de las industrias más complejas en materia de higiene y seguridad:
